[{"media_type":"application/octet-stream","path":"samples/above/mask.npy","producing_task":{"attempt":1,"hash":"ef/676fa1","origin_run_id":"1cbb6ca3-6513-45f4-9807-a81abc203f68","task_id":"2"},"role":"segmentation_mask","schema":"docs/data-dictionary.md#scientific-files","schema_version":"1.0.0","scope":{"kind":"sample","sample_id":"above"},"sha256":"59424a138729536c55dd8b1cf67ac0d55a4f0af377e78b8fdf0ff262d958edd3","size_bytes":4224},{"media_type":"application/json","path":"samples/above/metrics.json","producing_task":{"attempt":1,"hash":"ef/676fa1","origin_run_id":"1cbb6ca3-6513-45f4-9807-a81abc203f68","task_id":"2"},"role":"metrics","schema":"docs/data-dictionary.md#scientific-files","schema_version":"1.0.0","scope":{"kind":"sample","sample_id":"above"},"sha256":"8ff9daf6de2238a11853411fa5880381a07338cc0da4ba2b47ef378623fc1821","size_bytes":245},{"media_type":"text/csv","path":"samples/above/objects.csv","producing_task":{"attempt":1,"hash":"ef/676fa1","origin_run_id":"1cbb6ca3-6513-45f4-9807-a81abc203f68","task_id":"2"},"role":"measurements","schema":"docs/data-dictionary.md#scientific-files","schema_version":"1.0.0","scope":{"kind":"sample","sample_id":"above"},"sha256":"3dffe67c175648fc1f2647e268bda1ce5a241755471d109a898b3bf1ed457ca0","size_bytes":132},{"media_type":"image/png","path":"samples/above/preview.png","producing_task":{"attempt":1,"hash":"ef/676fa1","origin_run_id":"1cbb6ca3-6513-45f4-9807-a81abc203f68","task_id":"2"},"role":"preview","schema":"docs/data-dictionary.md#scientific-files","schema_version":"1.0.0","scope":{"kind":"sample","sample_id":"above"},"sha256":"3329982e16c4e850491cce842eebc9f36a01690afed634b322b0642536e7dfe2","size_bytes":378},{"media_type":"application/octet-stream","path":"samples/blank/mask.npy","producing_task":{"attempt":1,"hash":"ef/676fa1","origin_run_id":"1cbb6ca3-6513-45f4-9807-a81abc203f68","task_id":"2"},"role":"segmentation_mask","schema":"docs/data-dictionary.md#scientific-files","schema_version":"1.0.0","scope":{"kind":"sample","sample_id":"blank"},"sha256":"c1cf3cde9f391134c25953ffffb43c872dd154f4e621fb5790b0d0400a3f10c1","size_bytes":4224},{"media_type":"application/json","path":"samples/blank/metrics.json","producing_task":{"attempt":1,"hash":"ef/676fa1","origin_run_id":"1cbb6ca3-6513-45f4-9807-a81abc203f68","task_id":"2"},"role":"metrics","schema":"docs/data-dictionary.md#scientific-files","schema_version":"1.0.0","scope":{"kind":"sample","sample_id":"blank"},"sha256":"efd7b2c8876e5d8dc9be8bfe60308b351bd273b3c8c489bb7143babde5e0dfe9","size_bytes":239},{"media_type":"text/csv","path":"samples/blank/objects.csv","producing_task":{"attempt":1,"hash":"ef/676fa1","origin_run_id":"1cbb6ca3-6513-45f4-9807-a81abc203f68","task_id":"2"},"role":"measurements","schema":"docs/data-dictionary.md#scientific-files","schema_version":"1.0.0","scope":{"kind":"sample","sample_id":"blank"},"sha256":"4162d154c273eced119abffea42f177b82585282df10405818ca28c8daf86fa6","size_bytes":95},{"media_type":"image/png","path":"samples/blank/preview.png","producing_task":{"attempt":1,"hash":"ef/676fa1","origin_run_id":"1cbb6ca3-6513-45f4-9807-a81abc203f68","task_id":"2"},"role":"preview","schema":"docs/data-dictionary.md#scientific-files","schema_version":"1.0.0","scope":{"kind":"sample","sample_id":"blank"},"sha256":"d42b74f98e3517b563c158ac43d76b2f4994c08f961e5a10ae56dd1eacb5ae80","size_bytes":173},{"media_type":"application/octet-stream","path":"samples/border/mask.npy","producing_task":{"attempt":1,"hash":"ef/676fa1","origin_run_id":"1cbb6ca3-6513-45f4-9807-a81abc203f68","task_id":"2"},"role":"segmentation_mask","schema":"docs/data-dictionary.md#scientific-files","schema_version":"1.0.0","scope":{"kind":"sample","sample_id":"border"},"sha256":"7641180349a3a4e7b2608e0b4f659f8d8df375e1bd9ccd8c940ef865068be77b","size_bytes":4224},{"media_type":"application/json","path":"samples/border/metrics.json","producing_task":{"attempt":1,"hash":"ef/676fa1","origin_run_id":"1cbb6ca3-6513-45f4-9807-a81abc203f68","task_id":"2"},"role":"metrics","schema":"docs/data-dictionary.md#scientific-files","schema_version":"1.0.0","scope":{"kind":"sample","sample_id":"border"},"sha256":"917e375b93344d12c5f011de1765caad7baf7b73d7532f279e4e4bd6a9de457f","size_bytes":256},{"media_type":"text/csv","path":"samples/border/objects.csv","producing_task":{"attempt":1,"hash":"ef/676fa1","origin_run_id":"1cbb6ca3-6513-45f4-9807-a81abc203f68","task_id":"2"},"role":"measurements","schema":"docs/data-dictionary.md#scientific-files","schema_version":"1.0.0","scope":{"kind":"sample","sample_id":"border"},"sha256":"6ae20cf101253c30f8dee6dbfc9a8e160135ba6584dd220348b5b99289618646","size_bytes":161},{"media_type":"image/png","path":"samples/border/preview.png","producing_task":{"attempt":1,"hash":"ef/676fa1","origin_run_id":"1cbb6ca3-6513-45f4-9807-a81abc203f68","task_id":"2"},"role":"preview","schema":"docs/data-dictionary.md#scientific-files","schema_version":"1.0.0","scope":{"kind":"sample","sample_id":"border"},"sha256":"885cecfc5504322247b6aa15d89e79311ab5a6b9f3308bc0327d198dfd402ef7","size_bytes":243},{"media_type":"application/octet-stream","path":"samples/diagonal/mask.npy","producing_task":{"attempt":1,"hash":"ef/676fa1","origin_run_id":"1cbb6ca3-6513-45f4-9807-a81abc203f68","task_id":"2"},"role":"segmentation_mask","schema":"docs/data-dictionary.md#scientific-files","schema_version":"1.0.0","scope":{"kind":"sample","sample_id":"diagonal"},"sha256":"c2c56a446a0a33be2b4970343d4587197eac8b320f232e2e85a4273ad3469fe3","size_bytes":4224},{"media_type":"application/json","path":"samples/diagonal/metrics.json","producing_task":{"attempt":1,"hash":"ef/676fa1","origin_run_id":"1cbb6ca3-6513-45f4-9807-a81abc203f68","task_id":"2"},"role":"metrics","schema":"docs/data-dictionary.md#scientific-files","schema_version":"1.0.0","scope":{"kind":"sample","sample_id":"diagonal"},"sha256":"c7e51b0ef3d0ccf76ec142caf70e0f7914b2a4d84e17e46a4b13c0669a4f87f3","size_bytes":241},{"media_type":"text/csv","path":"samples/diagonal/objects.csv","producing_task":{"attempt":1,"hash":"ef/676fa1","origin_run_id":"1cbb6ca3-6513-45f4-9807-a81abc203f68","task_id":"2"},"role":"measurements","schema":"docs/data-dictionary.md#scientific-files","schema_version":"1.0.0","scope":{"kind":"sample","sample_id":"diagonal"},"sha256":"29461679ca7fbcd07f286f9ec83bf20db403300af0b4e53883dce9efdcdd7c73","size_bytes":136},{"media_type":"image/png","path":"samples/diagonal/preview.png","producing_task":{"attempt":1,"hash":"ef/676fa1","origin_run_id":"1cbb6ca3-6513-45f4-9807-a81abc203f68","task_id":"2"},"role":"preview","schema":"docs/data-dictionary.md#scientific-files","schema_version":"1.0.0","scope":{"kind":"sample","sample_id":"diagonal"},"sha256":"7a022a0f83010ce257c71486c720928aeae12e45b0d8da639eb0b898819b456d","size_bytes":350},{"media_type":"application/octet-stream","path":"samples/equality/mask.npy","producing_task":{"attempt":1,"hash":"a5/bc6b34","origin_run_id":"1cbb6ca3-6513-45f4-9807-a81abc203f68","task_id":"3"},"role":"segmentation_mask","schema":"docs/data-dictionary.md#scientific-files","schema_version":"1.0.0","scope":{"kind":"sample","sample_id":"equality"},"sha256":"c1cf3cde9f391134c25953ffffb43c872dd154f4e621fb5790b0d0400a3f10c1","size_bytes":4224},{"media_type":"application/json","path":"samples/equality/metrics.json","producing_task":{"attempt":1,"hash":"a5/bc6b34","origin_run_id":"1cbb6ca3-6513-45f4-9807-a81abc203f68","task_id":"3"},"role":"metrics","schema":"docs/data-dictionary.md#scientific-files","schema_version":"1.0.0","scope":{"kind":"sample","sample_id":"equality"},"sha256":"5e5f1ff0e2246a4a7b2eb0fcbf7fa9828e83483019d2309ecf4bfc27676013ab","size_bytes":242},{"media_type":"text/csv","path":"samples/equality/objects.csv","producing_task":{"attempt":1,"hash":"a5/bc6b34","origin_run_id":"1cbb6ca3-6513-45f4-9807-a81abc203f68","task_id":"3"},"role":"measurements","schema":"docs/data-dictionary.md#scientific-files","schema_version":"1.0.0","scope":{"kind":"sample","sample_id":"equality"},"sha256":"4162d154c273eced119abffea42f177b82585282df10405818ca28c8daf86fa6","size_bytes":95},{"media_type":"image/png","path":"samples/equality/preview.png","producing_task":{"attempt":1,"hash":"a5/bc6b34","origin_run_id":"1cbb6ca3-6513-45f4-9807-a81abc203f68","task_id":"3"},"role":"preview","schema":"docs/data-dictionary.md#scientific-files","schema_version":"1.0.0","scope":{"kind":"sample","sample_id":"equality"},"sha256":"82ce8b7e4e2405892a142a5127fef4d785b4c9758ca993a67edef947ccc25521","size_bytes":221},{"media_type":"application/octet-stream","path":"samples/full/mask.npy","producing_task":{"attempt":1,"hash":"a5/bc6b34","origin_run_id":"1cbb6ca3-6513-45f4-9807-a81abc203f68","task_id":"3"},"role":"segmentation_mask","schema":"docs/data-dictionary.md#scientific-files","schema_version":"1.0.0","scope":{"kind":"sample","sample_id":"full"},"sha256":"59424a138729536c55dd8b1cf67ac0d55a4f0af377e78b8fdf0ff262d958edd3","size_bytes":4224},{"media_type":"application/json","path":"samples/full/metrics.json","producing_task":{"attempt":1,"hash":"a5/bc6b34","origin_run_id":"1cbb6ca3-6513-45f4-9807-a81abc203f68","task_id":"3"},"role":"metrics","schema":"docs/data-dictionary.md#scientific-files","schema_version":"1.0.0","scope":{"kind":"sample","sample_id":"full"},"sha256":"443328d2a4dad326b5f50e280dc8ef1575095ce3a07fc980b70a28f4174f19d7","size_bytes":244},{"media_type":"text/csv","path":"samples/full/objects.csv","producing_task":{"attempt":1,"hash":"a5/bc6b34","origin_run_id":"1cbb6ca3-6513-45f4-9807-a81abc203f68","task_id":"3"},"role":"measurements","schema":"docs/data-dictionary.md#scientific-files","schema_version":"1.0.0","scope":{"kind":"sample","sample_id":"full"},"sha256":"234561a2c4407c668aede5c8fb629c9f703742e0fcfd4eb0720745897838289f","size_bytes":131},{"media_type":"image/png","path":"samples/full/preview.png","producing_task":{"attempt":1,"hash":"a5/bc6b34","origin_run_id":"1cbb6ca3-6513-45f4-9807-a81abc203f68","task_id":"3"},"role":"preview","schema":"docs/data-dic